{
  "type": "web",
  "city": "Edinburgh",
  "source_url": "https://www.edinburgh.gov.uk/attractions/historic-sites",
  "source_name": "Edinburgh Historic Sites",
  "source_type": "html",
  "crawl_depth": 2,
  "correlation_id": "f47ac10b-58cc-4372-a567-0e02b2c3d479",
  "trust_score": 0.9,
  "coordinates_confidence": 0.85,
  "priority": "high",
  "timeout_seconds": 600,
  "metadata": {
    "domain_authority": "gov",
    "last_updated": "2024-01-15T10:30:00Z",
    "content_type_hint": "text/html"
  }
}